{
  "$schema": "https://json-schema.org/draft/2020-12/schema",
  "type": "array",
  "items": {
    "type": "object",
    "required": ["id", "tool", "input", "expect"],
    "properties": {
      "id": { "type": "string" },
      "tool": { "type": "string" },
      "input": { "type": "object" },
      "expect": { "enum": ["hit", "pass"] },
      "edge": { "type": "boolean" }
    },
    "additionalProperties": false
  }
}
